{
	"simulation": {
		"engine": "MMCACovid19Vac",
		"start_date": "2020-02-09",
		"end_date": "2020-03-10",
		"save_full_output": false,
		"save_observables": true,
		"save_time_step": -1,
		"input_format": "csv",
		"output_folder": "output",
		"output_format": "netcdf"
	},
	"data": {
		"initial_condition_filename": "../models/catalonia/A0_initial_conditions_seeds.csv",
		"metapopulation_data_filename": "../models/catalonia/metapopulation_data.csv",
		"mobility_matrix_filename": "../models/catalonia/R_mobility_matrix.csv",
		"kappa0_filename": "../models/catalonia/kappa0.csv"
	},
	"epidemic_params": {
		"scale_β": 0.51,
		"βᴬ": 0.046053,
		"βᴵ": 0.0903,
		"ηᵍ": [0.2747252747252747, 0.2747252747252747, 0.2747252747252747],
		"αᵍ": [0.26595744680851063, 0.641025641025641, 0.641025641025641],
		"μᵍ": [1.0, 0.3125, 0.3125],
		"θᵍ": [0.0, 0.0, 0.0],
		"γᵍ": [0.003, 0.01, 0.08],
		"ζᵍ": [0.12820512820512822, 0.12820512820512822, 0.12820512820512822],
		"λᵍ": [1.0, 1.0, 1.0],
		"ωᵍ": [0.0, 0.04, 0.3],
		"ψᵍ": [0.14285714285714285, 0.14285714285714285, 0.14285714285714285],
		"χᵍ": [0.047619047619047616, 0.047619047619047616, 0.047619047619047616],
		"Λ": 0.02,
		"Γ": 0.01,
		"rᵥ": [0.0, 0.6, 0.0],
		"kᵥ": [0.0, 0.4, 0.0],
		"risk_reduction_dd": 0.0,
		"risk_reduction_h": 0.1,
		"risk_reduction_d": 0.05
	},
	"population_params": {
		"G_labels": ["Y", "M", "O"],
		"C": [
			[0.598, 0.38486, 0.01714],
			[0.244, 0.721, 0.0353],
			[0.1919, 0.5705, 0.2376]
		],
		"kᵍ": [11.8, 13.3, 6.76],
		"kᵍ_h": [3.15, 3.17, 3.28],
		"kᵍ_w": [1.72, 5.18, 0.0],
		"pᵍ": [0.0, 1.0, 0.0],
		"ξ": 0.01,
		"σ": 2.5,
		"mobility_variation_type": "external_netcdf",
		"mobility_external_file": "../test_data/mobility_validation/mobility_valid.nc",
		"mobility_external_variable": "mobility",
		"mobility_validate": true,
		"mobility_fill_missing": false,
		"mobility_time_alignment": "start"
	},
	"vaccination": {
		"ϵᵍ": [0.1, 0.4, 0.5],
		"percentage_of_vacc_per_day": 0.0,
		"start_vacc": 0,
		"dur_vacc": 0,
		"are_there_vaccines": false
	},
	"NPI": {
		"κ₀s": [0.8],
		"ϕs": [0.2],
		"δs": [0.8],
		"tᶜs": [100],
		"are_there_npi": true
	}
}
